{
  "families": [
    {
      "defaultModel": "claude-opus-5",
      "displayName": "Claude",
      "familyCode": "claude",
      "familyType": "llm",
      "primaryModality": "text",
      "sortOrder": 10
    }
  ],
  "regionCode": "global",
  "schemaVersion": "1.0.0",
  "vendorCode": "anthropic"
}
