{
  "families": [
    {
      "defaultModel": "deepseek-v4-pro",
      "displayName": "DeepSeek",
      "familyCode": "deepseek",
      "familyType": "llm",
      "primaryModality": "text",
      "sortOrder": 10
    }
  ],
  "regionCode": "global",
  "schemaVersion": "1.0.0",
  "vendorCode": "deepseek"
}
