{
  "families": [
    {
      "defaultModel": "MiniMax-M2.7",
      "displayName": "MiniMax",
      "familyCode": "minimax",
      "familyType": "multimodal",
      "primaryModality": "text",
      "sortOrder": 10
    }
  ],
  "regionCode": "global",
  "schemaVersion": "1.0.0",
  "vendorCode": "minimax"
}
